link,question,answer
http://www.sistani.org/english/qa/01224/,Is invocation of the jinn with a view to solving the problems of the faithful permissible?,"If it puts a person in harm’s way, it is harãm, and therefore forbidden."
http://www.sistani.org/english/qa/01166/,"If a mother advises her son to divorce his wife with whom she has differences, is it obligatory upon him to obey her in this matter? What if she says, “You are an ‘ãq (disowned) child, if you do not divorce her”?","It is not obligatory on him to obey her in this matter, and her statement [about him becoming disobedient] has no effect whatsoever. Of course, as mentioned earlier, it is necessary for him to hold back from any insulting statement or action towards her. He must reconcile with his wife and make sure to do whatever he can to save the marriage."
http://www.sistani.org/english/qa/01261/,Is mourning for Imam Hussain and other Infallibles (a.s.) recommended?,"Yes, it is recommended and God will reward those who sincerely revive their memories and commemorate their martyrdom?"
http://www.sistani.org/english/qa/01135/,An elderly person has a habit of doing gheebat and it is very difficult for me to stop him and I also do not want to hear but I am forced to. What should I do?,"To listen to someone who is backbiting is not Haram in it self, however the listener must act in accordance to enjoining the good (Amr bil Marouf) and forbidding the evil (Nahy anil Munkar)., and if it is not effective one must show their dissatisfaction from the person performing the backbiting."
http://www.sistani.org/english/qa/01250/,"Some Western governments allow the daughter to be independent of her parents, after she has passed the age of sixteen. If she seeks her parents advice, it is only for seeking their opinion or out of respect for them. Is such a virgin girl allowed to marry, be it permanent or a temporary marriage, without the consent of her father?","If this means that the father has allowed her to marry whomsoever she wants or that he has withdrawn from interfering in the matter of her marriage, it is permissible for her to do so; otherwise, based on obligatory precaution, it is not permissible."
http://www.sistani.org/english/qa/01166/,"If a Judge (Qazi) did all things for a divorce but didn’t give any certificate or any proof, can she get married again or she may have to wait for any certification or a period ?","Issuing a certificate is not a prerequisite or condition for the validity of divorce. {Meaning, a certificate issued cannot be enough proof for the validity of divorce}. There should be two just male witnesses and it should be carried out by the husband himself or his representative (wakil)."
http://www.sistani.org/english/qa/02657/,There is a woman who is breastfeeding her child and the child is dependent on the milk it is receiving from its mother. Can the mother break her fast since she fears for her child? Is it permissible for her not to fast?,"If a woman is suckling a child, whether she is the mother or a nurse, or suckles it free, and the quantity of her milk is small, and if fasting is harmful to her or to the child, it will not be obligatory on her to fast. And she should give one mudd of food stuffs (wheat or flour or noodles) per day to poor. 
In both the cases, she will later give qadha for the fasts left out. But this rule is specifically applicable in a circumstance where this is the only way of feeding milk to the child - (as an obligatory precaution). But if there is an alternative, like, when more than one woman offer to suckle the child, then establishing this rule is a matter of Ishkal."
http://www.sistani.org/english/qa/01306/,What is the duty of a Hajj pilgrim in the present circumstance in which the old distance between Safa and Marwah is closed and reconstructed whereas an alternate route has been opened for pilgrims to perform their Umrah? Is the Umra valid?,"The reply is in different forms: 
 N* 1- The pilgrim knows that Safa &amp; Marwa mounts do not continue up to the new Masa'a (place for Sai'ee). In this case, to be able to come out from the state of Ihram, the pilgrim should slaughter an animal (Kurbani) in Mecca -in terms of obligatory precaution, that animal should have the same conditions as the sacrifice in Mina- and distribute it among the poor and then cut his hair (Takseer) or shave his head (Halq). This applies to the one who was not aware of this current situation before being clothed in Ihram. Otherwise, if he had known this problem beforehand, according to obligatory precaution, he cannot come out from Ihram and should stay there until the accomplishment of the Sai'ee become possible for him. He may refer in this case to another Marja considering the most knowledgeable (Aalam fal Aalam) 
 N* 2- The pilgrim is sure that the mounts continue up to the new   
Masa'a or this is proven by the Fatwa of some other Maraje that   
trustees had witnessed and this witness is not contradicting the view of other trustees. In such case, it is allowed to do the Sai'ee in the new place. 
   N* 3- If none of the above situations are proven for him, he should do both: Sai'ee in the new way and also slaughtering an animal with the same conditions mentioned above, and then do Halq or Taqseer. 
 Note: 
 For those who have already done their Umra with the Sai'ee in the new way should now sacrifice the animal and then do Halq or Taqseer, even if they have already come back to their countries, as they are still considered as Muhrim (being in the state of Ihram)."
http://www.sistani.org/english/qa/01253/,"Is taking pictures of a dead body allowed, Haram or Makruh?",There is no problem in it.
http://www.sistani.org/english/qa/01234/,Is it obligatory for a woman to pay khums on the cash amount that she receives from her husband as mahr?,It is not obligatory.
http://www.sistani.org/english/qa/01247/,Is earning from professional sports halal?,It is halal.
http://www.sistani.org/english/qa/01296/,Can a woman who is in her menstrual period read or touch the Quran?,"Yes, she can read the Quran except for the those verses which include obligatory Sajdas. She cannot touch the verses."
http://www.sistani.org/english/qa/01231/,I have not been able to attend Friday prayers for many weeks.  What should I do?,"If you performed Zuhr prayer, it is sufficient."
http://www.sistani.org/english/qa/01151/,Can I be in a friendly relationship with a girl in my class.,"All kinds of relations with a non-mahram including joking, expressing mutual love, talking with the intention of deriving pleasure, looking at the body of a girl (except her face and hands up to the wrists) and at her hair or looking at her face with pleasure are Haram (forbidden).  In fact, if it is feared that they might fall into a sin, it is forbidden for them to have any kind of relationship with each other."
http://www.sistani.org/english/qa/01245/,"Some Western governments allow the daughter to be independent of her parents, after she has passed the age of sixteen. If she seeks her parents advice, it is only for seeking their opinion or out of respect for them. Is such a virgin girl allowed to marry, be it permanent or a temporary marriage, without the consent of her father?","If this means that the father has allowed her to marry whomsoever she wants or that he has withdrawn from interfering in the matter of her marriage, it is permissible for her to do so; otherwise, based on obligatory precaution, it is not permissible."
http://www.sistani.org/english/qa/01130/,Is it permissible to keep a dog as a pet in my house?,"It is better not to, and its preferable to choose another animal as a pet, as a dog is ritually impure (Najis) according to Islamic law, and thus it would cause one to live with considerable difficulty. It's also been mentioned that prayers in a place with a dog around is abominable (Makrooh)."
http://www.sistani.org/english/qa/01208/,"Is the chin obligatory to be covered as a form of Hijab, or is it part of the face, and not obligatory to be covered?","When the woman wears Hijab, usually her head, neck and body is covered, including the chin and some extra area, this part is not compulsory to cover."
http://www.sistani.org/english/qa/01260/,What is the fatwa about co-education? Is co-education permissible?,"If there is an evil in co-education, it is not allowed and Islam does not permit it. Normally, there is sin in co-education environments."
http://www.sistani.org/english/qa/01273/,"A woman, who is not obedient to her husband and does not carry out her matrimonial obligations, had, without his consent, left her matrimonial home and stayed with her parents for seven months. She, then went to a non-Islamic court, filed a divorce application, and demand maintenance and custody of the children. Has such a woman, who has violated her marital duties, any right in anything from her husband?","The said woman is not entitled to shari'i maintenance. As for her dowry and her right in nursing her offspring for the hawlayn (the two years), it should not be forfeited by virtue of nushouz (recalcitrance of the woman toward her husband) ."
http://www.sistani.org/english/qa/01222/,"It is recommended to perform hajj every year. However, there are many poor Muslims who are in dire need of food and clothing in various Muslim countries. If it comes to making a choice between spending the money for hajj repeatedly or ziyãrat (pilgrimage to the shrine of one of the Infallibles [a.s.]) and between giving in charity for those believers—which is more meritorious?","In principle, helping those needy Muslims is better than a recommended hajj or ziyãrat of the holy shrines. However, at times the hajj or the ziyãrat is associated with certain other issues that can elevate them to the same or even higher status of virtue."
http://www.sistani.org/english/qa/02662/,What is the Islamic law about someone who breaks his fast thinking it is not obligatory on him to fast?,"If he was certain that fasting is not obligatory on him, there is no kaffara on him nor is any fidya payable. However, Qadha is obligatory on him but if he was not certain about fasting not being obligatory, he should give both Qadha and kaffara. The kaffara is to feed sixty poor Shia Muslims by one mudd (750 grams) of foodstuffs to each 60 different needy Shia Muslims.  Qadha should be performed in the same year and if it is delayed until the next Ramadhan, he should give the Qadha and kaffara of 750 grams of food stuffs for each day to the poor. If the Qadha is delayed again in the following years, the kaffara is not repeated."
http://www.sistani.org/english/qa/02651/,I have a daughter who has attained the age of puberty and she must fast according to Islamic law but she is too weak to fast. How should she go about fasting?,"A person cannot abandon fast on account of weakness. However, if she is so weak that fasting becomes totally unbearable, there is no objection to her breaking the fast. However, the necessary precaution is that she should suffice to eating and drinking to the extent of necessity only and she should also observe the qadha after the month of Ramadhan and she will not be liable to any kaffara."
http://www.sistani.org/english/qa/01290/,"Is it obligatory to inform the man who wants to marry a woman from the Ahlul Kitab or a Muslim woman that she has not yet observed the waiting period (‘idda) of a divorce of a previous marriage, or that she is still in the ‘idda [during which marriage is forbidden for her]?",It is not obligatory.
http://www.sistani.org/english/qa/01208/,"I am a married man and live in a joint family system; my father, mother, grand father, my younger brother and my uncle live in my house; how about my wife's hijab in such a situation?","Your wife is Mahram to your father and grandfather only and not to your uncle or brother, and must observe Hijab from them (your uncle and brother)."
http://www.sistani.org/english/qa/01159/,"What about imported cheese from non-Muslim countries, if I do not exactly know the way it was made and its ingredients?",It is permissible for you to eat it.
http://www.sistani.org/english/qa/01232/,Who is a just person?,"A person is said to be just when he performs all those acts which are obligatory upon him, and refrains from all those things which are forbidden to him. And the sign of being just is that one is apparently of a good character, so that if inquiries are made about him from the people of his locality, or from his neighbours, or from those persons with whom he lives, they would confirm his good conduct."
http://www.sistani.org/english/qa/01276/,"Are collyrium and rings among the exceptions in Shari'ah?  In other words, is it permissible to wear in front of na-mahram men ?","Although these are among the exceptions and women can wear them in front of non-mahram men, it is necessary that they do not intend to show them to non-mahram and that wearing them does not generally entail any evil and she , at the same time, does not know that she will fall into a sin by wearing them. The precaution is to avoid wearing them in all situations."
http://www.sistani.org/english/qa/01131/,Is the third testimony a part of Adhan and Iqamah?,"Ash hadu anna Amiral Mu'minina 'Aliyyan Waliyyullah ( I testify that the Commander of the faithful, Imam Ali (AS) is the vicegerent of Allah) is not a part of Adhan and Iqamah, but it is good to say it after reciting Ash hadu anna Muhammadan Rasulul lah with the intention (Niyyat) of Qurbat (seeking nearness to Allah)."
http://www.sistani.org/english/qa/01271/,"A person used to make mistakes in the way he performed his wudhu (minor ablution) or ghusl (major ablution). After many years, he comes to realize his mistakes. When he inquires as how to solve his problem, he is told: ""Repeat all your prayers and perform the pilgrimage again."" Since saying all the prayers and doing the pilgrimage again is difficult, is there a solution which would salvage his prayers and pilgrimage performed with wudhu and ghusl that he thought was correct? Is there such a solution as a concession to this person so that he does not become disheartened and rebellions against religious obligations in a society which encourages such kind of rebellion?","If he was ignorant out of innocence, and therefore made mistakes without causing harm (e.g., did not follow the proper sequence in washing the head and the other parts of the body in ghusl; or did the wiping of the head or feet [mash] with a new water), then his wudhu and ghusl will be considered correct; and, consequently, his past prayers and pilgrimage will also be considered correct. 
But if he was ignorant out of negligence in learning the Islamic laws or did mistakes which do invalidate the act in general (e.g., leaving out some parts of the body which must be washed in wudhu or ghusl), there is no way to validate his past prayers and pilgrimage. 
However, if there is the fear that he would totally rebel when asked to make up all the past prayers and pilgrimage, then it is not appropriate to ask him to do so. Maybe Allah will improve his situation in future."
http://www.sistani.org/english/qa/01226/,"If a person doubts whether he performed Istibra or not, what should he do?","If a person doubts whether he has performed Istibra or not, and then discharges a liquid about which he is not sure whether it is Pak or not, that liquid is will be deemed najis, and if he has performed Wudhu it becomes void. However, if he doubts whe ther he performed the Istibra correctly or not, and a liquid is discharged about which he is not sure whether it is Pak or not, that liquid will be Pak, and it will not invalidate the Wudhu."
http://www.sistani.org/english/qa/01330/,"Is it permissible to be party to temporary marriage with a woman who is “known for adultery”, if no other woman is available and the person is in desperate need of marriage?","Based on obligatory precaution, one should refrain from marrying such a woman except after her repentance.."
http://www.sistani.org/english/qa/01262/,"I am 19 years old and a convert to Islam of five months. My question is, being a practitioner of Twelver Jaf'ari Islam is it permissible for me to pray behind a Sunni Imam for Salaatul-Jummah and for regular congregational prayers, and is it required to prostrate on Turbah inside a mosque?","Taking part in Friday and congregational prayers of the Ahl-e Sunnat is permissible in areas where Taqiyah (dissimulation) is required. If you are not going to face a problem, you should, as far as possible, prostrate on a stone or anything upon which Sajda (prostration) is permissible. Prostration on carpets in the case of Taqiyah or out of necessity is permissible and there would be no objection in it. But if you are not offering your prayers with them out of Taqiyah it is not necessary to attend their congregational prayers and you can offer your prayers separately."
http://www.sistani.org/english/qa/01200/,"Some people recite Quran and Dua on the tune of some songs, is this permissible?","If the recitation is not in a Lahvi manner, it is not Haram. (Lahvi means something that is provocative and suitable for revelry)."
http://www.sistani.org/english/qa/01314/,"What is the view on a man embracing another man with lust, and go about kissing one another with sexual desire? What if they go even further and enter the domain of deviant sexual behaviour?",All of this is harãm even if there might be difference in the degree of prohibition.
http://www.sistani.org/english/qa/01209/,Is hypnotism permissible?,"If it puts a person in harm’s way, it is harãm, and therefore forbidden."
http://www.sistani.org/english/qa/01242/,"A Muslim dies in a non-Muslim city that has no Muslim graveyard and the family of the deceased cannot transfer the body to a Muslim country because it cannot afford the cost of transportation. In such cases, is it obligatory upon the Islamic centers that are responsible for Muslims’ affairs to provide the cost of transportation? And is this obligatory upon the Muslims who reside in that city?","If burying the deceased in an appropriate grave in that same city or other city (excluding non-Muslim graveyards) depends on spending some money, and neither has he left any estate that can pay for it nor are the heirs capable of providing for it—then it is wãjib kifã’i upon the Muslims to provide for it. And it is permissible to count it from the religious or charitable dues applicable to him."
http://www.sistani.org/english/qa/01246/,"Just as many questions are asked about halãl and harãm music, many questions are asked about halãl and harãm songs. Is it correct to say that harãm songs are those that arouse sexual, lustful urges and promote unstable and degrading behaviour? Is it correct to say that songs that do not arouse lustful desires, but elevate the souls and thoughts to lofty levels like religious songs of praise dedicated to the Prophet Muhammad (s.a.w.) and the Imams (a.s.), or the songs that lift the spirits and morale [of the fighters] and the like are halãl songs?","All songs (al-ghinã’) are harãm. Based on the definition that we accept, al-ghinã’ is the entertaining expression by way of tunes that are common to those who provide entertainment and amusement.  In this prohibition, we should include the recitation of the Holy Qur’ãn, supplications (du‘ãs), and songs of praise of Ahlul Bayt (a.s.) uttered to the accompaniment of those tunes [that are used by the entertainers]. The prohibition of reciting other non-entertaining expressions —like songs intended to lift the morale [of fighters]— is based on compulsory precaution. However, the tune that cannot be described as such is not harãm by itself."
http://www.sistani.org/english/qa/01219/,What does Taqlid mean in religious laws?,"Taqlid in religious laws means acting according to the verdict of a Mujtahid. It is necessary for the Mujtahid who is followed, to be male, Shi'ah Ithna Ash'ari, adult, sane, of legitimate birth, living and just ('Adil). A person is said to be just whe n he performs all those acts which are obligatory upon him, and refrains from all those things which are forbidden to him. And the sign of being just is that one is apparently of a good character, so that if enquiries are made about him from the people of his locality, or from his neighbours, or from those persons with whom he lives, they would confirm his good conduct. And if one knows that the verdicts of the Mujtahids differ with regard to the problems which we face in every day life, it is necessary t hat the Mujtahid who is followed be A'lam (the most learned), who is more capable of understanding the divine laws than any of the contemporary Mujtahids."
http://www.sistani.org/english/qa/01254/,Is it necessary for a woman to compensate the prayers and fasts which she missed during menses?,"A woman must perform the Qaza of the FASTS which she has missed during her menstrual period. However, Qaza of prayers is not obligatory on her."
http://www.sistani.org/english/qa/01234/,"Some governments and some companies in non-Muslim as well as Muslim countries deposit the salaries of their employees directly into their accounts in the banks. The employee does not get the money in his hand, although he can withdraw it whenever he wants. Now, if the statement of his account shows that the money has surpassed his annual expenses, is khums obligatory on it?","Khums is obligatory in what has surpassed his annual needs, except in the case of a government employee in a Muslim state that deposits his salary into a state or private bank. In the latter case, khums would not be obligatory on the salary that has been deposited in the bank until he [physically] takes possession of it. Then the salary will be included in his income of that year and khums will become obligatory on what is in excess to that year’s expenses."
http://www.sistani.org/english/qa/01164/,"A wife neither obeys her husband nor fulfills her marital duties; she also goes out without his permission to stay with her own family for seven months. Then instead of having recourse to Islamic laws, she goes to a non-Islamic court in order to get spousal maintenance, custody of the children, and divorce from her husband. Does such a wife have the right in getting anything from her husband? In such a situation, when she goes to non-Islamic court it will apply non-Islamic laws to grant her divorce and her rights (spousal support and custody of children), does she deserve her full spousal rights?",The wife mentioned above does not deserve the spousal maintenance from a shari’a point of view. But her mahr (dowry) and her right of custody of children (under the age of two) should not be suspended because of her disobedience.
http://www.sistani.org/english/qa/01136/,Some men shave their beard and leave some hair on the chin alone. Is this sufficient according to Shariah?,"French-cut box beard is not sufficient as an obligatory precaution. In this ruling, you may refer to the next learned Mujtahid."
http://www.sistani.org/english/qa/01234/,Can I give my Sahm-e Imam to a local mosque for its reconstruction and renovation?,You should fix the amount that you want to give and then ask for ejaza (permission) from your Mujtahid.
http://www.sistani.org/english/qa/01251/,"At times we find the name or picture of fish on the cans and come to know that the fish is a scale fish. So, is it permissible for us to rely on the name or the picture in determining the category of fish, knowing well that a wrong statement of this kind would put the manufacturers in great loss or even more serious [situation] than just a loss?","If one is satisfied it is the truth, it is permissible to act upon it."
http://www.sistani.org/english/qa/01152/,"Even though some manufacturers write on their products that they have been made of natural silk, we doubt such a claim because of the goods being very cheap. Is it permissible for us to wear such an item and say salãt in it?","With doubt [whether the silk is pure], it is permissible to wear and perform prayers in it."
http://www.sistani.org/english/qa/01277/,"Are we allowed to donate our organs upon our death? For example our heart, liver, kidneys? Is the soul still attached to the body once we are dead, or is that not true?","It is permissible, but it is not  permissible, as a measure of precaution, to cut an organ of a dead Muslim if he bequeathed, unless a Muslim’s life is in danger."
http://www.sistani.org/english/qa/01210/,Can we eat a meal that has been cooked by a non-Muslim whose religion we do not know?,"It is permissible to eat the food and it is not necessary for the Muslim to question the person who prepared the food about his beliefs or disbeliefs, or whether or not he had touched the food, even if that inquiry is very convenient and natural for one who wants to ask."
http://www.sistani.org/english/qa/01188/,"Can a person brush his teeth during Ihram, if there is likelihood of bleeding?",It is permissible.
http://www.sistani.org/english/qa/01121/,"Is a mother allowed to abort the feotus, if she does not want it while the soul has not yet entered it and there is no serious danger to the mother’s life?","She is not allowed to do that, except if the continuation of the pregnancy would considerably harm her health or put her in an unbearable difficulty, then it is permissible before the soul enters the feoutus (i.e. the fourth month)."
http://www.sistani.org/english/qa/01180/,"Can one perform Eid prayers, (Eid al-Fitr or Eid al-Adha), at home, by myself, or must I recite these prayers in congregation at the mosque?",There is no problem in reciting the Eid prayers by yourself alone (Furada).
