link,question,answer
http://www.sistani.org/english/qa/01249/,"When a person is diagnosed as having ADIS, is it permissible for the doctor or is it obligatory on him to inform the patient’s relatives, especially their spouse?","It is permissible to inform them, if the patient or his guardian gives consent. It is obligatory if the survival —for a longer time span— of the patient depends on it. It is similarly obligatory, if he knows that by not informing them, the virus would infect them for not taking necessary precautions."
http://www.sistani.org/english/qa/01220/,"If I know that the bank will give me interest even without stipulating the conditions, is it permissible for me to deposit in a savings account that takes the form of a term-deposit?","Yes, it is permissible, as long as you do not stipulate the conditions of interest."
http://www.sistani.org/english/qa/01172/,Is it permissible for women to dance in front of other women or for men to dance in front of other men in a gender-wise segregated gathering?,"Dancing of women in front of women or dancing of men in front of other men is problematic, as a matter of obligatory precaution, one must refrain from it."
http://www.sistani.org/english/qa/01134/,"Are girls and women allowed to wear black coat and scarf all year round, even when it's not the months of Muharram &amp; Safar? 
Is it Makrooh?","There is no problem in it, and it is not abominable (Makrooh )"
http://www.sistani.org/english/qa/01131/,Is the recitation of Adhan and Iqama for daily prayers and other prayers compulsory (Wajib)?,"Adhan and Iqama for the daily obligatory prayers (i.e Fajr, Dhuhr, Asr, Maghreb and Isha), is recommended (Mustahab), however for the other obligatory and recommended prayers it is not been sanctioned in Islamic Law (they are not Mashru')."
http://www.sistani.org/english/qa/01167/,"When there is no heir for a deceased Muslim person in the foreign land, who should take charge of his burial?","If it is not possible to contact his heir and ask his consent in handling the burial procedures, the requirement of consent is lifted and it becomes obligatory, on basis of wajib kifã’i, on the Muslims to handle the burial."
http://www.sistani.org/english/qa/01149/,Is salat valid if the person uses cologne? Is cologne ritually pure?,"Yes, it is pure (Tahir) and Salat with it is correct."
http://www.sistani.org/english/qa/01281/,I am living in India and I have a lot of doubts about things I am using and I eating. What is my duty about such things?,"A well known religious law says: ""Everything is ritually pure for you unless you come to know that it is ritually impure."" This law declares everything to be pure unless one becomes sure a particular item has become impure. And as long as you are not sure that it has become ritually impure (najis), it is to be considered pure and you can apply all the rules of purity to it without any hesitation or doubt."
http://www.sistani.org/english/qa/01292/,"Is it permissible to draw or produce a scene which shows the Prophet Muhammad (s.a.w.), one of the past prophets or the infallible Imams (a.s.), or other luminaries and show it in cinema, on television or theatre?","If due deference and respect is observed, and the scene does not contain anything that would detract from their holy pictures in the minds [of the viewers], there is no problem."
http://www.sistani.org/english/qa/01220/,"Is it permissible to receive interest from a non-Muslim bank? What about taking loan with interest, is it permissible?",It is absolutely permissible to take interest from a non-Muslim bank. Even making a condition for obtaining interest is permissible. Taking a loan with an interest is not permissible unless one takes it with the intention of securing the money after which he considers it as loan given to him on behalf of Hakim Shar’a (Mujtahed).
http://www.sistani.org/english/qa/01237/,If I pray with a leather belt or a wallet made from leather of a mayta and realize it during the salat or after finishing it but before the end of its time span or after the ending of its time span-what would become of that prayer?,"The prayer with a wallet made from leather of a mayta is valid just as it is acceptable to pray with a belt made from such a leather, provided that the probability of it being from zabiha is not a very low probability that would be ignored by sensible people. 
In the second case [of very low probability], if he was ignorant [of this rule] and realized during salat, he should take it off immediately and his salat would be valid. The same rule would apply if he forgot [that he had the wallet or the belt on him] and remembered during salat, provided that his forgetfulness was not a result of carelessness and indifference. In other cases, he will have to repeat salat in time or qadha as a matter of obligatory precaution."
http://www.sistani.org/english/qa/01230/,What is Jabira?,The splint with which a wound or a fractured bone is bandaged or held tight and the medication applied to a wound etc. is called Jabira.
http://www.sistani.org/english/qa/01185/,Is Friday prayer obligatory?,"It is wajib-e takhyeri, meaning it is obligatory but optional at the same time; that is, if a person performs Friday prayer, he does not have to say Dhuhr (noon) prayer."
http://www.sistani.org/english/qa/01178/,Is mushroom a Halal vegetable?,"Yes, it is halal."
http://www.sistani.org/english/qa/01207/,"I am working in a company and supposed to shake hands with customers, male or female.  If don't do that, it would be considered impolite and there is a risk of losing my job and suffering the aftermath? What should I do?","A Muslim man is not allowed to shake hands with a woman without a barrier, such as gloves, unless refraining from shaking hands will put him in a considerable harm or unbearable difficulty. In the latter case, he is allowed to shake hands to the extent of necessity only."
http://www.sistani.org/english/qa/02656/,I am pregnant and would like to know whether I should fast or not.,"Fasting is not obligatory on a woman in an advanced stage of pregnancy, for whom fasting is harmful or for the child she carries. For every day, however, she should give one mudd (750 grams) of food to poor. In both the cases, she has to give qadha for the fasts which are left out. 
Also, if a woman who is not in an advanced stage of pregnancy but fasting is harmful or unbearably difficult, fasting is not wajib on her. She must keep the qadha later and there is no kaffara on her. 
In both case, if a woman fails to observe the Qadha of the missed fast until next Ramadhan, she must, as an obligatory precaution, give another kaffara because of delaying the Qadha."
http://www.sistani.org/english/qa/01225/,"Are girls and women allowed to wear black coat and scarf all year round, even when it's not Muharram?",It is permissible.
http://www.sistani.org/english/qa/01133/,"Is it permissible to buy a carving or statue of a human being or an animal, male or female, for decoration?","There is no problem in buying and selling it, however carving and making a statute of a human or animal is not permissible (obligatory precaution)."
http://www.sistani.org/english/qa/01123/,I am running a store and I have non-Muslim customers who want me to sell them alcoholic drinks. Can a Muslim buy and sell intoxicating alcohol to non-Muslims?,It is not permissible to buy and sell alcohol.
http://www.sistani.org/english/qa/01253/,Is it right to say ya Ali madad?,There is no objection in it.
http://www.sistani.org/english/qa/01253/,What is the concept of co-education in Islam?,"If religious standards are observed and if it entails no evil, there would be no objection in it."
http://www.sistani.org/english/qa/01226/,Why should we do Istibra and how is it done?,"Istibra is a recommended act for men after urinating. Its object is to ensure that no more urine is left in the urethra. There are certain ways of performing Istibra, and the best of them is that after the passing of urine, if the anus also becomes najis it is made clean first. 
Thereafter, the part between the anus and the root of penis should be pressed thrice, with the mid dle finger of the left hand. Then the thumb is placed on the penis, and the forefinger below it pressing three times up to the point of circumcision, then the front part of the penis should be jerked three times."
http://www.sistani.org/english/qa/01248/,What is the meaning of at-ta'arrub ba'd al-hijra which is one of the major sins?,"Some jurists have said that during our time, it applies to residing in countries that may cause the loss of faith. It means the migration of a person from a country -where it is possible for him to learn the obligatory religious teachings and laws, and where it is possible for him to fulfill his obligations and refrain from what is forbidden- to a country where this possibility does not exist fully or partially."
http://www.sistani.org/english/qa/01250/,I am virgin girl but independent financially. Is it is necessary to obtain my guardian's permission for marriage?,It is necessary to seek your father or paternal grandfather's permission.
http://www.sistani.org/english/qa/01238/,"Is it permissible to tell a lie, when there is a danger threatening your life?",It is permissible in the said supposition.
http://www.sistani.org/english/qa/01269/,"Is cream a barrier to water reaching the skin, and if so should it be removed prior to wudhu and ghusl?","Apparently the effect left on the skin after it is applied is nothing but just moisture, and so it does not constitute a barrier to water reaching the skin."
http://www.sistani.org/english/qa/01350/,"A person used to make mistakes in the way he performed his wudhu (minor ablution) or ghusl (major ablution). After many years, he comes to realize his mistakes. When he inquires as how to solve his problem, he is told: ""Repeat all your prayers and perform the pilgrimage again."" Since saying all the prayers and doing the pilgrimage again is difficult, is there a solution which would salvage his prayers and pilgrimage performed with wudhu and ghusl that he thought was correct? Is there such a solution as a concession to this person so that he does not become disheartened and rebellions against religious obligations in a society which encourages such kind of rebellion?","If he was ignorant out of innocence, and therefore made mistakes without causing harm (e.g., did not follow the proper sequence in washing the head and the other parts of the body in ghusl; or did the wiping of the head or feet [mash] with a new water), then his wudhu and ghusl will be considered correct; and, consequently, his past prayers and pilgrimage will also be considered correct. 
But if he was ignorant out of negligence in learning the Islamic laws or did mistakes which do invalidate the act in general (e.g., leaving out some parts of the body which must be washed in wudhu or ghusl), there is no way to validate his past prayers and pilgrimage. 
However, if there is the fear that he would totally rebel when asked to make up all the past prayers and pilgrimage, then it is not appropriate to ask him to do so. Maybe Allah will improve his situation in future."
http://www.sistani.org/english/qa/01255/,What are the minimum requirements of Hijab (Islamic modest dress) for a Muslim woman?,"Woman should conceal her body and hair from a man who is non-Mahram, and as an obligatory precaution, she should conceal herself even from a Na-baligh boy who is able to discern between good and evil, and could probably be sexually excited. But she can leave her face and hands upto wrists uncovered in the presence of Na-Mahram, as long as it does not lead him to casting a sinful, evil glance or her to doing something forbidden; for in both these cases, she must cover them."
http://www.sistani.org/english/qa/01125/,"Over the past thirty years, we have been placing candles in our local mosque as a sign of grief and lamentation. Can we give lamps to the mosque instead of burning candles?",There is no problem in it.
http://www.sistani.org/english/qa/01239/,"Banks in the West give loans —known as mortgage— to those who do not have enough money to buy houses; this is to be paid back in [weekly or monthly] instalments with a high rate of interest. Is a Muslim allowed to use this facility? If it is not permissible, is there a solution in your view for someone who claims that he needs the mortgage to buy his own residential house and does not possess enough money to pay for it?",It is permissible to take the money from the bank that is financed by non-Muslim government or private funds but not with the intention of loan. The knowledge that the bank will sooner or later force him to pay the capital as well as the interest does not affect [the lawfulness of] his taking the money.
http://www.sistani.org/english/qa/01159/,"(In the case of) imported cheese from non-Muslim countries, if it is known to contain rennet (anfahah) from a calf or a young goat, or an animal enzyme, is it permissible to consume it?",There is no objection in consuming them.
http://www.sistani.org/english/qa/01268/,"The floor of most houses in the West is covered with carpet which is glued to the floor in such a way that it is difficult to lift it off. How can such a carpet be rendered pure (tahir), if it becomes impure with urine or blood? The water used to purify in both the cases could be qalil or kathir. Please explain the ruling in both cases.","If it is possible to wipe the water off the carpet by using a piece of cloth or a vacuum cleaner, it can be purified with qalil water, provided that the water is wiped off the carpet, in the process. Conversely, it must be purified by kathir water [i.e., by using a hose pipe connected to the tap]."
http://www.sistani.org/english/qa/01135/,"What is the proper definition of 'backbiting'? Please, give some references from the Quran and Hadith also.","Backbiting means “speaking ill of a believer in their absence of someone with the purpose of disparaging him, no matter whether the alleged shortcoming was related to his body, lineage, behaviour, deeds, statements, religion, or life, and other defects which are [usually] concealed from the people. Similarly, it does not matter whether the description was done by words or by gesture.” 
Almighty Allãh condemned backbiting in His noble Book and has described it such that mind and body feel abhorrence towards it. He said, “And some of you should not backbite the others: would anyone of you like to eat the flesh of his dead brother? No, you abhor it.” (49:12) 
The Prophet (s.a.w.) said, “Be careful of backbiting because backbiting is worse than adultery, in that a person who commits adultery can repent and ask forgiveness from God, and Allãh can forgive him whereas Allãh will not forgive the backbiter until the person who was at the receiving end forgives him.”"
http://www.sistani.org/english/qa/01250/,"Is it permissible to look carefully at the body, with exception of the private parts, of the woman one intends to marry with sexual motivation or without it?","It is permissible to look at the woman’s features like the face, the hair, and the hands but without lustful intention. And [it is permissible], even if one knows that lustful thoughts will naturally occur [by looking at her]. When a person has come to know about her features by the first look, it is not permissible to look again."
http://www.sistani.org/english/qa/01152/,"Jurists have decreed that it is forbidden [for men] to wear pure and natural silk. Is it permissible for a man to wear silk that is mixed with other material if that clothing item is a necktie [or the normal tie]? And is it forbidden for man to wear the necktie, if it is made of natural and pure silk?","It is not forbidden to wear a tie, even if it is from pure silk because it is not [big enough material] to cover the private parts that must be covered [in prayer]. As for the item that is mixed with other material to the extent that it cannot be described as “pure silk,” it is permissible to wear, even if it [is big enough so that it] can cover the private parts that must be covered [in prayer]."
http://www.sistani.org/english/qa/01228/,We enter some super markets in Europe and find meat in tin containers produced by a European company with the writing on the package that conveys the sense of it being “halãl” or “slaughtered according to Islamic laws”. Is it permissible to buy and eat such meat?,The writing [on the package] has no value if it does not lead to certainty [that it is actually halãl].
http://www.sistani.org/english/qa/01133/,"What is the Islamic law about buying a car on installments? Many auto companies and authorized car selling agencies sell new and used cars on installments. Thus, when customers go to buy those cars, the companies refer them to certain institutions such as banks and insurance companies. The companies get back the capital as well as the interest in monthly installments stretched over a number of months or years. If someone fails to pay his installments on time, the company overcharges the defaulter.  The interest rate is determined on the basis of certain important factors such as the client's turnover, amount of income or timely-repayment of installments. The amount of interest generally paid is 4%, 3% or 5% or more or less. What is the Islam law with regard to buying a car on monthly installments keeping in view the foregoing details?","If the loan providing companies first buy the cars from the agencies and then sell them to customers on installments with some increase (interest) as part of the prices of the cars, the transaction is in order. Indeed, if a penalty is imposed due to a customer failing to make payment on time, it is forbidden (harām).  
And if it means that the companies or agencies themselves sell the cars to customers, and in return the loan providing company gives the price of the cars to their manufacturers or agencies, and receives more money on installments from the customer, it is forbidden."
http://www.sistani.org/english/qa/01235/,What is the stand on giving a non-Muslim the Qur`an for him or her to learn about the Qur`an and our faith if it is Arabic text?,"Given the supposition made in your message, if the Quran is not made Najis or disrespected by them, there would be no problem."
http://www.sistani.org/english/qa/01283/,Is it alright to do sajdah on concrete or on mosaic?,"Yes, it is alright."
http://www.sistani.org/english/qa/01250/,I am virgin girl but independent financially. Is it is necessary to obtain my guardian's permission for marriage?,It is necessary to seek your father or paternal grandfather's permission.
http://www.sistani.org/english/qa/01215/,"Can a Muslim individual take part in lectures, seminars, etc. in which women are in complete, proper Hijab?",There is no problem in it.
http://www.sistani.org/english/qa/01198/,"If I forget to do Ghusl Janabat and then after four days, I remember that I did not performed Ghusl Janabat. In this case, what is my obligation, do I have to do Ghusl and give the Qadha of the prayers that I offered?",You must perform Ghusl Janaba and fulfill the Qadha of your prayers.
http://www.sistani.org/english/qa/01205/,"When there is no heir for a deceased Muslim person in the foreign land, who should take charge of his burial?","If it is not possible to contact his heir and ask his consent in handling the burial procedures, the requirement of consent is lifted and it becomes obligatory, on basis of wajib kifã’i, on the Muslims to handle the burial."
http://www.sistani.org/english/qa/01358/,"Is it permissible for a ""Sayyid"" to have Sadaqa for their needs? If it is permissible, then please specify the condition.","It is permissible for a Hashimi to give his sadaqa to another Hashimi or to a non-Hashimi. This includes both Zakat of property and zakat of Fitra. But it is not permissible for a non-Hashimi to give his Sadaqa to a Hashimi. If a Hashimi receives Zakat of property or fitra from a non-Hashimi, it would be forbidden for him to use it, and he who gives it (zakat), his ""Zimma"" (obligation) would not be discharged. In cases other than those mentioned above it is permissible for a non-Hashimi to give his Sadaqa, atonement, or Fidya of fast ( kaffara) or any desirable charity to a Hashimi. Yes, if charity given to a Hashimi is too little an amount of property and it is given with the intention of repulsing calamity and evil, there is Ishkaal (objection) in its being permissible."
http://www.sistani.org/english/qa/01122/,Are we allowed to adopt children and consider them as our own children?,"It is permissible for a person to adopt a child and taking care of a deserving child on its own earns is a rewarding deed, but the child legally (Islamic Shariah) is not considered his son or daughter; i.e. the child remains non-mahram to him or his wife and he or she does not inherit from the ones who has adopted him or her.  
Adoption in the sense to change a child's surname and register him in the official documents as the parents own child is not permissible."
http://www.sistani.org/english/qa/01288/,Is it permissible to watch porn movies or pictures of naked ladies.,It is not permissible to watch them.
http://www.sistani.org/english/qa/01244/,"If my wife wants me to masturbate in front of her, is it then allowed?","You are not allowed to excite yourself with your own hands, but you can do it with your wife's hand."
http://www.sistani.org/english/qa/01266/,If Ramadhan crescent is sighted in one city would it suffice the sighting in another city?,"Should the new moon be sighted in a city, it would suffice the sighting in another city, provided the two fall on the same horizon. That is, if the new moon was sighted in the first town, there would be a distinct possibility of sighting it in the second, barring any obstacles, such as clouds and high mountains ."
http://www.sistani.org/english/qa/01231/,Can I perform Jumu'ah prayers with Sunnis?,You should perform Zuhr prayer separately; performing Jumu'ah prayers with them is not enough.
http://www.sistani.org/english/qa/01179/,"A person has entered a country as a visitor and his passport was stamped that he was not allowed to work. If he works illegally and gets the money 'under the table', is it halal?","If the visa was granted against an undertaking that the person should not engage in any sort of employment during the period of his stay in the country, his infringement of the undertaking is Haram. However, this should not deny him the wages for the work; it is permissible that he has the right of disposal over it as he deems fit."
